ID_A,STICKER_ITEMS_ID,LOCALES,STRING,EXTRA_A1,EXTRA_A2,EXTRA_A3
1286,16,bn_IN,হলুদ হাঁস এবং গোলাপী রঙয়ের স্নানের টুপি সহ বাথটাবে সেমুর স্লথ,,,
1287,16,bn_BD,হলুদ হাঁস ও গোলাপি গোসলের ক্যাপসহ Seymour Sloth বাথটাবে বসে আছে,,,
1288,16,bs,Seymour Sloth u kadi sa žutom patkicom i roza kapom za tuširanje,,,
1289,16,bg,Сеймур Слот във вана с жълто патенце и розова шапка за душ,,,
1290,16,ca,El Seymour el peresós dins la banyera amb un ànec groc i un barret de dutxa rosa,,,
1291,16,zn_CN,西摩树懒和小黄鸭在浴缸中，戴着粉色浴帽,,,
1292,16,zn_HK,Seymour Sloth 手拿黃色小鴨和頭戴粉色浴帽在浴缸中,,,
1293,16,zn_TW,頭戴粉紅浴帽的西摩樹懶在浴缸洗澡，還有漂浮的黃色小鴨,,,
1294,16,hr,Seymour Sloth u kadi sa žutom patkicom i ružičastom kapom za tuširanje,,,
1295,16,cs,Seymour Sloth je ve vaně se žlutou kačenkou a v růžové koupací čepici,,,
1296,16,da,Seymour Sloth i badekar med gul badeand og lyserød badehætte,,,
1297,16,nl,Seymour Sloth in bad met gele eend en roze badmuts,,,
1298,16,et_EE,Laiskloom Seymour on vannis kollase pardiga ja roosa dušimütsiga,,,
1299,16,fa,سیمور تنبل در وان حمام با کلاه دوش صورتی و اردک زرد,,,
1300,16,tl,Seymour Sloth sa bathtub na may dilaw na ducky at pink na shower cap,,,
1301,16,fi,"Seymour Sloth kylpyammeessa keltaisen ankan kanssa, päällään vaaleanpunainen suihkumyssy",,,
1302,16,fr,Seymour Sloth dans une baignoire avec un canard jaune et une charlotte rose,,,
1303,16,fr_CA,Seymour Sloth dans une baignoire avec un canard jaune et une charlotte rose,,,
1304,16,gl_ES,Seymour Sloth nunha bañeira cun pato amarelo e un gorro de ducha rosa,,,
1305,16,ka_GE,სეიმურ სლოთი აბაზანაშია ყვითელი იხვითა და ვარდისფერი შხაპის ქუდით,,,
1306,16,de,Fabi Faultier in Badewanne mit gelber Ente und rosa Duschhaube,,,
1307,16,el,Ο Seymour Sloth στην μπανιέρα με κίτρινο παπάκι και ροζ καπελάκι για το ντους,,,
1308,16,gu_IN,પીળા બતક અને ગુલાબી શાવર કૅપ સાથે બાથટબમાં સિમૌર સ્લૉથ,,,
1309,16,iw,סימור העצלן באמבטיה עם ברווז גומי וכובע רחצה ורוד,,,
1310,16,hi,बाथटब के अंदर पीले रंग डकी और गुलाबी रंग के शॉवर कैप के साथ सीमौर स्लॉथ,,,
1311,16,hu,Lajhár Lali a fürdőkádban ül egy sárga kacsával és rózsaszín fürdősapkában,,,
1312,16,is_IS,Seymour Sloth er í baði með gula gúmmíönd og bleika sturtuhettu,,,
1313,16,in,Seymour Sloth di bak mandi dengan bebek kuning dan topi mandi warna merah muda,,,
1314,16,ga,"Séamas an Spadán san fholcadán lena lacha bhuí, agus caipín cithfholctha bándearg air",,,
1315,16,it,Seymour il Bradipo nella vasca da bagno con paperella gialla e cuffietta rosa,,,
1316,16,ja,黄色いアヒルが浮かぶ浴槽に入る、ピンクのシャワーキャップをしたシーモアスロース,,,
1317,16,kn_IN,ಸೆಮೌರ್ ಸ್ಲೌಥ್ ಬಾತ್‍ಟಬ್‍ನಲ್ಲಿ ಹಳದಿ ಡಕ್ಕಿ ಮತ್ತು ಗುಲಾಬಿ ಶವರ್ ಕ್ಯಾಪ್ ಜೊತೆಗೆ,,,
1318,16,kk_KZ,Басына қызғылт қалпақша киген Сеймур жалқау аң кішкентай сары үйрекпен ваннада,,,
1319,16,km_KH,Seymour Sloth ក្នុង​អាង​ទឹក​ជាមួយ​កូន​ទា​ពណ៌​លឿង​និង​មួក​មុជទឹក​ពណ៌​ស៊ីជម្ពូ,,,
1320,16,ko,샤워캡을 쓰고 욕조에서 목욕하는 나무늘보,,,
1321,16,ky_KG,Ваннада сары өрдөк оюнчук жана күлгүн шапка кийген Сеймур аттуу ленивец,,,
1322,16,lo_LA,ເຊມົວສະລັອດ ຢູ່ໃນອ່າງອາບນ້ຳພ້ອມມີໝວກໃສ່ອາບນ້ຳສີເຫຼືອງແລະສີບົວທີ່ໜ້າຮັກ,,,
1323,16,lv,Seymour Sloth sēž vannā ar dzeltenu pīlīti un rozā dušas cepuri,,,
1324,16,lt,Tinginys Seymour vonioje su geltonu ančiuku rožine maudymosi kepuraite,,,
1325,16,mk_MK,Мрзливецот Симор во када со жолто пајче и розова капа за туширање,,,
1326,16,ms_MY,Seymour Sloth di dalam tab mandi dengan mainan itik kuning dan topi mandi merah jambu,,,
1327,16,ml_IN,മഞ്ഞ ഡക്കിയും പിങ്ക് ഷവർ കേപ്പുമായി സെയ്മോർ സ്ലോത്ത് ബാത്ത്ടബ്ബിൽ,,,
1328,16,mr_IN,पिवळे बदक आणि गुलाबी शॉवर टोपी सह बाथटब मध्ये सेमोर स्लॉथ,,,
1329,16,my_ZG,အဝါေရာင္ ဘဲ႐ုပ္ေလးႏွင့္ ပန္းေရာင္ေရခ်ိဳးေဆာင္း ဦးထုပ္ျဖင့္ ေရခ်ိဳးကန္ထဲရွိ ေဆးမာဆေလာ့သ္,,,
1330,16,mn_MN,Улбар шар нугасны тоглоомтой яагаан усны малгайтай ванн дээр хэвтэж буй Залхуу Сеймур,,,
1331,16,my_MM,အဝါရောင် ဘဲရုပ်လေးနှင့် ပန်းရောင်ရေချိုးဆောင်း ဦးထုပ်ဖြင့် ရေချိုးကန်ထဲရှိ ဆေးမာဆလော့သ်,,,
1332,16,ne_NP,सेमोर स्लथ पहेँलो हाँस र गुलाबी सावर क्यापका साथ बाथटबमा,,,
1333,16,nb,Seymour Sloth i badekaret med gul and og rosa dusjhette,,,
1334,16,or,ସ୍ନାନକୁଣ୍ଡରେ ହଳଦିଆ ଡକି ଏବଂ ଗୋଲାପୀ ସାୱାର୍ କ୍ୟାପ୍ ସହ ସେମୌର ସ୍ଲୋଥ୍,,,
1335,16,pl,Leniwiec Seymour w różowym czepku kąpielowym bawi się w wannie żółtą kaczuszką,,,
1336,16,pt_PT,Seymour Sloth na banheira com patinho amarelo e touca de banho rosa,,,
1337,16,pt_BR,Seymour Sloth na banheira com um patinho amarelo e touca de banho rosa,,,
1338,16,pa_IN,ਸੀਮੋਰ ਸਲੋਥ ਬਾਥਟੱਬ ਵਿੱਚ ਪੀਲੀ ਬੱਤਖ ਅਤੇ ਗੁਲਾਬੀ ਰੰਗ ਦੀ ਨਹਾਉਣ ਵਾਲੀ ਕੈਪ ਦੇ ਨਾਲ,,,
1339,16,ro,"Leneșul Seymour în cadă, cu o rățușcă galbenă și cască de baie roz",,,
1340,16,ru,Ленивец Сеймур в розовой шапочке для душа и с желтой уточкой лежит в ванной,,,
1341,16,sr,Lenjivac Lale u kadi sa žutom patkicom i ružičastom kapom za kupanje,,,
1342,16,si_LK,සීමෝ කම්මැලියා කහ පාට තාරාවෙකු සහ රෝස ෂවර වැස්මක් සමග නාන බේසමේ සිටියි,,,
1343,16,sk,Seymour Sloth je vo vani so žltou kačičkou a v ružovej kúpacej čiapke,,,
1344,16,sl,Seymour Sloth v kadi z rumeno gumijasto račko in rožnato kopalno kapo,,,
1345,16,es_ES,Seymour el perezoso en la bañera con un patito amarillo y un gorro de baño rosa,,,
1346,16,es_US,Seymour el perezoso en la bañera con un patito amarillo y un gorro de baño rosa,,,
1347,16,sv,Simon Sengångare i ett badkar med en gul badanka och rosa badmössa,,,
1348,16,tg,Коҳилаки тамбал дар ванна бо мурғобии зард ва кулоҳи гулобӣ,,,
1349,16,ta_IN,மஞ்சள் நிற வாத்து பொம்மை மற்றும் பிங்க் நிற குளியல் தொப்பியுடன் குளியல் தொட்டியில் உள்ள சீமோர் ஸ்லாத்,,,
1350,16,te_IN,పసుపు రంగు బాతు మరియు గులాబి రంగు షవర్ క్యాప్‌తో బాత్‌టబ్‌లో ఉన్న సేమోర్ స్లాత్,,,
1351,16,tk,Seýmur Slot sary ördejik bilen we gülgüne duş şapkaly,,,
1352,16,th,ซีมัวร์สล็อธในอ่างอาบน้ำพร้อมเป็ดยางสีเหลืองและหมวกอาบน้ำสีชมพู,,,
1353,16,bo,མུ་ཞེ་སོ་ལེ་དང་ངང་སེར་ནི་ཉ་རྫ་ནང་དུ་འདུག་ཅིང་འཁྲུས་ཞྭ་སེར་པོ་གོན།,,,
1354,16,tr,Sarı ördek ve pembe duş bonesiyle küvette Seymour Sloth,,,
1355,16,uk,Лінивець Сеймур в рожевій шапочці для душу у ванній з жовтою качечкою,,,
1356,16,ur_PK,سیمور سلوتھ باتھ ٹب میں پیلا ڈکی اور گلابی شاور والی ٹوپی کے ساتھ,,,
1357,16,ug,سېرىق لۆڭگە ئارتىپ ئۆردەك قونچاق بار يۇيۇنداقتا يۇيۇنغان سېيمور ئېرىنچەك,,,
1358,16,uz_UZ,Seymur Slot sariq o‘rdakcha va pushti vanna qalpog‘i kiygan holda vannada o‘tiribdi,,,
1359,16,vi,Lười Seymour trong bồn tắm với vịt đồ chơi màu vàng và mũ tắm màu hồng,,,
1360,16,predefined,sticker_peace,,,
1361,17,en,Seymour Sloth waving two fingers held up in V with palm facing out,,,
1362,17,en_US,Seymour Sloth waving two fingers held up in V with palm facing out,,,
1363,17,en_CA,Seymour Sloth waving two fingers held up in V with palm facing out,,,
1364,17,sq_AL,"Arushi Seymour duke përshëndetur me dy gishta në formë V-je, me pëllëmbë të kthyer nga jashtë",,,
1365,17,ar,الكسلان Seymour يلوّح بإصبعين بشكل V وكفه نحو الخارج,,,
1366,17,hy_AM,Սեյմուր համրուկը՝ V տեսքի երկու մատները թափահարող և ձեռքի ափը՝ դեպի դուրս,,,
1367,17,as,হাতৰ তলুৱাখন সন্মুখফালে ৰাখি দুটা আঙুলি V-ৰ দৰে কৰি হাত লৰাই থকা চেইমোৰ শ্লোথ,,,
1368,17,az_AZ,Seymur ərincək iki barmağını V göstərərək yellədir,,,
1369,17,eu_ES,Seymour Sloth agur egiten bi hatz V forman dituela eta esku azpia kanpora begira duela,,,
1370,17,be_BY,Лянівец Сэймур махае двума пальцамі ў форме V з адкрытай далонню,,,
1371,17,bn_IN,হাতের তালু সামনের দিকে দেখানো সহ দুটি আঙুল দিয়ে V আকার তরঙ্গায়িত করতে থাকা সেমুর স্লথ,,,
1372,17,bn_BD,Seymour Sloth হাতের তালু দেখিয়ে দু’টি আঙুল V আকৃতির করে নাড়ছে,,,
1373,17,bs,Seymour Sloth maše s dva prsta s kojima pravi V i s dlanom ispruženim naprijed,,,
1374,17,bg,"Сеймур Слот размахва два пръста, разположени в буквата „V“ с длан, обърната навън",,,
1375,17,ca,El Seymour el peresós saluda amb dos dits en forma de V i el palmell de la mà cap a fora,,,
1376,17,zn_CN,西摩树懒掌心向外用两根手指比 V 字,,,
1377,17,zn_HK,Seymour Sloth 揮動著兩根手指，手掌朝外手指呈 V 字型,,,
1378,17,zn_TW,西摩樹懶掌心朝外以兩隻手指擺出勝利手勢揮手,,,
1379,17,hr,Seymour Sloth maše s dva prsta u obliku slova V i dlanom okrenutim od sebe,,,
1380,17,cs,Seymour Sloth mává se vztyčenou rukou a dvěma prsty do V,,,
1381,17,da,Seymour Sloth holder to fingre op i V-tegn med håndfladen fremad,,,
1382,17,nl,Seymour Sloth zwaait met twee vingers in V-vorm en palm naar buiten,,,
1383,17,et_EE,"Laiskloom Seymour lehvitab, hoides kaht sõrme V-kujuliselt ja peopesa välja suunatud",,,
1384,17,fa,سیمور تنبل در حال تکان دادن دو انگشت وی شکل و کف دست رو به بیرون,,,
1385,17,tl,Seymour Sloth kumakaway na naka-V ang dalawang daliri at labas ang palad,,,
1386,17,fi,Seymour Sloth heiluttaa kahta V-asennossa olevaa sormea kämmen ulospäin,,,
1387,17,fr,"Seymour Sloth en train de faire un signe V avec deux doigts levés, paume vers l'extérieur",,,
1388,17,fr_CA,"Seymour Sloth en train de faire un signe V avec deux doigts levés, paume vers l'extérieur",,,
1389,17,gl_ES,Seymour Sloth movendo dous dedos en forma de V coa palma orientada cara a fóra,,,
1390,17,ka_GE,"სეიმურ სლოთი ორი თითით აჩვენებს V ნიშანს ისე, რომ ხელის გული შეტრიალებული აქვს გარეთ",,,
1391,17,de,Fabi Faultier schwenkt seine zum Victoryzeichen geformte Hand,,,
1392,17,el,Ο Seymour Sloth χαιρετάει σχηματίζοντας το σήμα της νίκης με δύο δάχτυλα και έχει την παλάμη στραμμένη προς τα έξω,,,
1393,17,gu_IN,"બે આંગળી V આકારમાં પહોળી કરી, હથેળી બહારની બાજુ આવે તે રીતે હાથ હલાવતો સિમૌર સ્લૉથ",,,
1394,17,iw,סימור העצלן מסמן V בשתי אצבעות כאשר כף ידו מופנית קדימה,,,
1395,17,hi,सीमौर स्लॉथ हथेली को बाहर की तरफ करके उंगलियों के माध्यम से V की आकृति बनाकर लहराते हुए,,,
1396,17,hu,Lajhár Lali két ujjával V alakot formálva feltartja a kezét tenyérrel kifelé,,,
1397,17,is_IS,Seymour Sloth veifar tveimur fingrum sem mynda V og lófinn snýr út,,,
1398,17,in,Seymour Sloth melambaikan dua jari berbentuk V dengan telapak tangan menghadap ke luar,,,
1399,17,ga,"Séamas an Spadán ag croitheadh dhá mhéar i gcruth V, aghaidh bhos a láimhe chun tosaigh",,,
1400,17,it,Seymour il Bradipo che fa il segno V con due dita e il palmo rivolto all’esterno,,,
1401,17,ja,2本の指をVサインにして相手に向けて振っているシーモアスロース,,,
1402,17,kn_IN,ಸೆಮೌರ್ ಸ್ಲೌಥ್ V ಆಕೃತಿಯ ಅಂಗೈಯಲ್ಲಿ ಎರಡು ಬೆರಳುಗಳನ್ನು ತೋರಿಸಿ ಕೈಬೀಸುವುದು,,,
1403,17,kk_KZ,Сеймур жалқау аң алақанын сыртқа қаратқан екі саусағымен V белгісін көрсетіп қол бұлғауда,,,
1404,17,km_KH,Seymour Sloth បក់​ម្រាមដៃ​ពីរ មាន​រាង V ដោយ​បាតដៃ​បែរ​ចេញ​ក្រៅ,,,
1405,17,ko,두 손가락으로 브이자를 그린 나무늘보,,,
1406,17,ky_KG,"Сеймур аттуу ленивец эки колу менен алаканы сыртты карап, V жаңсоосун кылат",,,
1407,17,lo_LA,ເຊມົວສະລັອດ ກຳລັງໂບກມືດ້ວຍການຍົກມືສອງນິ້ວຂຶ້ນເປັນຮູບໂຕ V ພ້ອມຝ່າມືຫັນອອກ,,,
1408,17,lv,"Seymour Sloth rāda V zīmē paceltus pirkstus, ar plaukstu pavērstu uz āru",,,
1409,17,lt,"Tinginys Seymour mojuoja du pirštus laikydamas V forma, o delnas nukreiptas žemyn",,,
1410,17,mk_MK,Мрзливецот Симор мавта со два прста во облик на латиничната буква В со дланката нанапред,,,
1411,17,ms_MY,Seymour Sloth melambaikan dua jari berbentuk V dengan tapak tangan menghadap ke depan,,,
1412,17,ml_IN,കൈപ്പത്തി പുറത്തുകാണിച്ച് രണ്ട് വിരലുകൾ വീശി വിജയ ചിഹ്നം കാണിക്കുന്ന സെയ്മോർ സ്ലോത്ത്,,,
1413,17,mr_IN,पंजा बाहेरच्या दिशेने ठेऊन दोन बोटे V आकारात धरून हलवणारा सेमोर स्लॉथ,,,
1414,17,my_ZG,လက္ဖဝါးကို ေရွ႕ဘက္မ်က္ႏွာမူလ်က္ လက္ႏွစ္ေခ်ာင္းျဖင့္ V ပံုစံ ေထာင္၍ ေဝွ႕ယမ္းျပေနသည့္ ေဆးမာဆေလာ့သ္,,,
1415,17,mn_MN,Хоёр хуруугаараа V хэлбэрээр даллаж буй Залхуу Сеймур,,,
1416,17,my_MM,လက်ဖဝါးကို ရှေ့ဘက်မျက်နှာမူလျက် လက်နှစ်ချောင်းဖြင့် V ပုံစံ ထောင်၍ ဝှေ့ယမ်းပြနေသည့် ဆေးမာဆလော့သ်,,,
1417,17,ne_NP,सेमोर स्लथ हत्केला बाहिर फर्काएर V आकारमा दुई औँलाहरू हल्लाइरहेको,,,
1418,17,nb,Seymour Sloth som vinker med to fingre i en V med håndflaten ut,,,
1419,17,or,ପାପୁଲିକୁ ବାହାରକୁ କରି ଆଙ୍ଗୁଠିଗୁଡିକ ମାଧ୍ୟମରେ Vର ଆକୃତି କରି ହଲାଉଥିବା ସେମୌର ସ୍ଲୋଥ୍,,,
1420,17,pl,Leniwiec Seymour pokazuje „victorię” z wewnętrzną stroną dłoni skierowaną na zewnątrz,,,
1421,17,pt_PT,Seymour Sloth a acenar com dois dedos em V e a palma da mão virada para fora,,,
1422,17,pt_BR,Seymour Sloth acenando dois dedos erguidos em forma de V com a palma da mão para fora,,,
1423,17,pa_IN,ਸੀਮੋਰ ਸਲੋਥ ਹਥੇਲੀ ਸਾਹਮਣੇ ਵੱਲ ਕਰਕੇ V ਆਕਾਰ ਵਿੱਚ ਦੋ ਉਂਗਲਾਂ ਨਾਲ ਹੱਥ ਹਿਲਾਉਂਦੇ ਹੋਏ,,,
1424,17,ro,"Leneșul Seymour fluturând două degete ținute în formă de „V”, cu palma îndreptată în afară",,,
1425,17,ru,"Ленивец Сеймур машет лапой ладонью наружу, сложив два пальца в виде буквы V",,,
1426,17,sr,Lenjivac Lale maše sa dva prsta podignuta u znaku slova V sa dlanom okrenutim ka napred,,,
1427,17,si_LK,සීමෝ කම්මැලියා අත්ල අභිමුඛව V ආකාරයෙන් ඇඟිලි දෙකක් වනමින්,,,
1428,17,sk,Seymour Sloth máva so vztýčenou dlaňou a dvomi prstami do V,,,
1429,17,sl,Seymour Sloth z navzven iztegnjeno dlanjo s prstoma kaže znak V,,,
1430,17,es_ES,Seymour el perezoso saludando con dos dedos extendidos en forma de V y la palma hacia fuera,,,
1431,17,es_US,Seymour el perezoso saluda con dos dedos extendidos en forma de V y la palma hacia fuera,,,
1432,17,sv,Simon Sengångare vinkar med två fingrar i V-gest och handflatan utåt,,,
1433,17,tg,Коҳилаки тамбал дастро аломати “Сулҳ” карда алвонҷ медиҳад,,,
1434,17,ta_IN,"உள்ளங்கை வெளியே தெரியுமாறு, V என்பது போல் தோன்றும் இரு விரல்களை அசைக்கும் சீமோர் ஸ்லாத்",,,
1435,17,te_IN,"అర చేతిని పైకి పెట్టి, కదులుతూ రెండు వేళ్లను వి ఆకారంలో ఉంచిన సేమోర్ స్లాత్",,,
1436,17,tk,Seýmur Slot eliň aýasyny daşyna tutup iki barmagy V şeklinde tutup galgaýar,,,
1437,17,th,ซีมัวร์สล็อธชูนิ้วเป็นตัว V โบกไปมาโดยหันฝ่ามือออก,,,
1438,17,bo,མུ་ཞེ་སོ་ལེས་ལག་མཐིལ་ཕྱིར་གཏད་ཅིང་མཛུབ་མོ་གཉིས་པོས་V་ཚུགས་བཟོས།,,,
1439,17,tr,Avcu dışarı bakacak şekilde iki parmağını V şeklinde sallayan Seymour Sloth,,,
1440,17,uk,Лінивець Сеймур показує жест перемоги двома пальцями долоні,,,
1441,17,ur_PK,سیمور سلوتھ اپنی ہتھیلی کو الٹا کرکے دو انگلیوں سے وی کا نشان بناکر دکھاتا ہوا,,,
1442,17,ug,ئالقىنىنى سىرتقا قىلىپ ئىككى بارماقتا ئاچىماق چىقارغان سېيمور ئېرىنچەك,,,
1443,17,uz_UZ,Seymur Slot kafti tashqariga qaragan va ikkita barmog‘i V ko‘rinishida salomlashmoqda,,,
1444,17,vi,Lười Seymour lắc hai ngón tay chữ V với lòng bàn tay hướng ra ngoài,,,
1445,17,predefined,sticker_bye,,,
1446,18,en,Seymour Sloth smiling and dancing,,,
1447,18,en_US,Seymour Sloth smiling and dancing,,,
1448,18,en_CA,Seymour Sloth smiling and dancing,,,
1449,18,sq_AL,Arushi Seymour duke kërcyer buzagaz,,,
1450,18,ar,الكسلان Seymour يبتسم ويرقص,,,
1451,18,hy_AM,Ժպտացող և պարող Սեյմուր համրուկը,,,
1452,18,as,হাঁহি আৰু নাচি থকা চেইমোৰ শ্লোথ,,,
1453,18,az_AZ,Seymur ərincək gülümsəyir və rəqs edir,,,
1454,18,eu_ES,Seymour Sloth irribarrez eta dantzan,,,
1455,18,be_BY,Лянівец Сэймур усміхаецца і танцуе,,,
1456,18,bn_IN,হাসি এবং নৃত্যরত সেমুর স্লথ,,,
1457,18,bn_BD,Seymour Sloth মুচকি হাসছে ও নাচছে,,,
1458,18,bs,Seymour Sloth se smije i pleše,,,
1459,18,bg,Сеймур Слот се усмихва и танцува,,,
1460,18,ca,El Seymour el peresós somrient i ballant,,,
1461,18,zn_CN,西摩树懒微笑着跳舞,,,
1462,18,zn_HK,Seymour Sloth 笑著跳舞,,,
1463,18,zn_TW,樹懶笑著跳舞,,,
1464,18,hr,Seymour Sloth smije se i pleše,,,
1465,18,cs,Seymour Sloth se směje a tančí,,,
1466,18,da,Seymour Sloth smiler og danser,,,
1467,18,nl,Seymour Sloth glimlacht en danst,,,
1468,18,et_EE,Laiskloom Seymour naeratab ja tantsib,,,
1469,18,fa,سیمور تنبل در حال خنده و رقص,,,
1470,18,tl,Seymour Sloth nakangiti at sumasayaw,,,
1471,18,fi,Seymour Sloth hymyilee ja tanssii,,,
1472,18,fr,Seymour Sloth en train de sourire et de danser,,,
1473,18,fr_CA,Seymour Sloth en train de sourire et de danser,,,
1474,18,gl_ES,Seymour Sloth sorrindo e bailando,,,
1475,18,ka_GE,სეიმურ სლოთი იღიმის და ცეკვავს,,,
1476,18,de,Fabi Faultier lächelt und tanzt,,,
1477,18,el,Ο Seymour Sloth χαμογελάει και χορεύει,,,
1478,18,gu_IN,સ્મિત આપી નાચતો સિમૌર સ્લૉથ,,,
1479,18,iw,סימור העצלן מחייך ורוקד,,,
1480,18,hi,मुस्कुराते हुए नाचता हुआ सीमौर स्लॉथ,,,
1481,18,hu,Lajhár Lali mosolyog és táncol,,,
1482,18,is_IS,Seymour Sloth dansar brosandi,,,
1483,18,in,Seymour Sloth tersenyum dan menari,,,
1484,18,ga,Séamas an Spadán gealgháireach agus ag damhsa,,,
1485,18,it,Seymour il Bradipo che balla e sorride,,,
1486,18,ja,笑顔でダンスするシーモアスロース,,,
1487,18,kn_IN,ಸೆಮೌರ್ ಸ್ಲೌಥ್ ನಗುವುದು ಮತ್ತು ಕುಣಿಯುವುದು,,,
1488,18,kk_KZ,Сеймур жалқау аң күлімсіреп білеп жатыр,,,
1489,18,km_KH,Seymour Sloth ញញឹម​និង​រាំ,,,
1490,18,ko,미소지으며 춤추는 나무늘보,,,
1491,18,ky_KG,"Сеймур аттуу ленивец күлүп, бийлейт",,,
1492,18,lo_LA,ເຊມົວສະລັອດ ກຳລັງຍິ້ມ ແລະ ເຕັ້ນລຳ,,,
1493,18,lv,Seymour Sloth smaida un dejo,,,
1494,18,lt,Tinginys Seymour šypsosi ir šoka,,,
1495,18,mk_MK,Мрзливецот Симор се смее и танцува,,,
1496,18,ms_MY,Seymour Sloth tersenyum dan menari,,,
1497,18,ml_IN,പുഞ്ചിരിച്ച് നൃത്തം ചെയ്യുന്ന സെയ്മോർ സ്ലോത്ത്,,,
1498,18,mr_IN,हसणारा आणि नाचणारा सेमोर स्लॉथ,,,
1499,18,my_ZG,ျပံဳး၍ ကေနသည့္ ေဆးမာဆေလာ့သ္,,,
1500,18,mn_MN,Инээмсэглэн бүжиглэж буй Залхуу Сеймур,,,
1501,18,my_MM,ပြုံး၍ ကနေသည့် ဆေးမာဆလော့သ်,,,
1502,18,ne_NP,सेमोर स्लथ मुस्कुराइरहेको र नाचिरहेको,,,
1503,18,nb,Seymour Sloth som smiler og danser,,,
1504,18,or,ହସ ହସ ଏବଂ ନାଚୁଥିବା ସେମୌର ସ୍ଲୋଥ୍,,,
1505,18,pl,Leniwiec Seymour uśmiecha się i tańczy,,,
1506,18,pt_PT,Seymour Sloth a sorrir e a dançar,,,
1507,18,pt_BR,Seymour Sloth sorrindo e dançando,,,
1508,18,pa_IN,ਸੀਮੋਰ ਸਲੋਥ ਹੱਸਦੇ ਅਤੇ ਨੱਚਦੇ ਹੋਏ,,,
1509,18,ro,Leneșul Seymour zâmbind și dansând,,,
1510,18,ru,Ленивец Сеймур улыбается и танцует,,,
1511,18,sr,Lenjivac Lale se smeši i pleše,,,
1512,18,si_LK,සීමෝ කම්මැලියා හිනාවෙමින් නටයි,,,
1513,18,sk,Seymour Sloth sa smeje a tancuje,,,
1514,18,sl,Seymour Sloth se smehlja in pleše,,,
1515,18,es_ES,Seymour el perezoso sonriendo y bailando,,,
1516,18,es_US,Seymour el perezoso sonríe y baila,,,
